{
  "id": "55555555-5555-4555-8555-555555555555",
  "course_id": "66666666-6666-4666-8666-666666666666",
  "source_document_id": "77777777-7777-4777-8777-777777777777",
  "title": "Sample lesson",
  "bloom_level": "understand",
  "status": "draft",
  "published_at": null,
  "created_at": "2026-04-22T12:00:00+00:00"
}
